connection c1
DROP TABLE IF EXISTS t1;
CREATE TABLE t1 (k INT NOT NULL, a INT NOT NULL, b INT NOT NULL, c INT NOT NULL, PRIMARY KEY(k)) ENGINE=InnoDB;
INSERT INTO t1 (k, a, b, c) VALUES (1, 0, 0, 0);
INSERT INTO t1 (k, a, b, c) VALUES (2, 0, 0, 0);
INSERT INTO t1 (k, a, b, c) VALUES (3, 0, 0, 0);
INSERT INTO t1 (k, a, b, c) VALUES (4, 0, 0, 0);
SET GLOBAL group_commit_timeout_usecs=90000;
SET GLOBAL group_commit_min_size=2;
""
Verify that a timeout occurs in c1 for group commit when the transactions
modify the same row 
echo ""
RESET MASTER;
SET DEBUG_SYNC= 'RESET';
SET GLOBAL innodb_prepare_commit_mutex=0;
SET GLOBAL sync_binlog=1;
SET GLOBAL force_binlog_order=1;
connection c1
BEGIN;
UPDATE t1 SET a=11 WHERE k=1;
SET DEBUG_SYNC='after_prepare1 SIGNAL c1_prepared WAIT_FOR c2_prepared TIMEOUT 3';
COMMIT;;
connection c2
BEGIN;
SET DEBUG_SYNC='now WAIT_FOR c1_prepared TIMEOUT 3';
SELECT * FROM t1 WHERE k=1;
k	a	b	c
1	0	0	0
UPDATE t1 SET a=21 WHERE k=1;
SET DEBUG_SYNC='after_prepare1 SIGNAL c2_prepared';
COMMIT;
connection c1
Warnings:
Warning	1639	debug sync point wait timed out
select * from t1 where k=1;
k	a	b	c
1	21	0	0
""
cleanup
""
SET DEBUG_SYNC= 'RESET';
SET GLOBAL force_binlog_order=1;
SET GLOBAL innodb_prepare_commit_mutex=1;
SET GLOBAL group_commit_timeout_usecs=1000;
SET GLOBAL group_commit_min_size=8;
SET GLOBAL sync_binlog=0;
DROP TABLE t1;
