stop slave;
drop table if exists t1,t2,t3,t4,t5,t6,t7,t8,t9;
reset master;
reset slave;
drop table if exists t1,t2,t3,t4,t5,t6,t7,t8,t9;
start slave;
DROP TABLE IF EXISTS t1;
# Establish connection con1 (user=root)
# Establish connection con2 (user=root)
# Establish connection con3 (user=root)
# Establish connection con4 (user=root)
# reset replication to guarantee that master-bin.000001 is used
STOP SLAVE;
RESET SLAVE;
RESET MASTER;
CHANGE MASTER TO master_host="127.0.0.1",master_port=MASTER_PORT,master_user="root";
START SLAVE;
# Switch to connection con1
CREATE TABLE t1 (a INT PRIMARY KEY) ENGINE=innodb;
INSERT INTO t1 VALUES(1);
START TRANSACTION WITH CONSISTENT INNODB SNAPSHOT;
File	Position
master-bin.000001	400
# Switch to connection con2
INSERT INTO t1 VALUES(2);
INSERT INTO t1 VALUES(3);
# Switch to connection con1
SELECT * FROM t1;
a
1
COMMIT;
SELECT * FROM t1;
a
1
2
3
DROP TABLE t1;
# Switch to connection con1
CREATE TABLE t1 (a INT PRIMARY KEY) ENGINE=innodb;
INSERT INTO t1 VALUES(1);
START TRANSACTION WITH CONSISTENT INNODB SNAPSHOT;
File	Position
master-bin.000001	1134
START TRANSACTION WITH CONSISTENT INNODB SNAPSHOT;
File	Position
master-bin.000001	1134
START TRANSACTION WITH CONSISTENT INNODB SNAPSHOT;
File	Position
master-bin.000001	1134
START TRANSACTION WITH CONSISTENT INNODB SNAPSHOT;
File	Position
master-bin.000001	1134
# Switch to connection con2
INSERT INTO t1 VALUES(2);
INSERT INTO t1 VALUES(3);
# Switch to connection con1
SELECT * FROM t1;
a
1
SELECT * INTO OUTFILE '<MYSQLTEST_VARDIR>/tmp/rpl_innodb_snapshot.out.file' FROM t1;
COMMIT;
# Switch to slave
CREATE TABLE t1_backup AS SELECT * FROM t1;
STOP SLAVE;
RESET SLAVE;
DELETE FROM t1;
LOAD DATA INFILE '<MYSQLTEST_VARDIR>/tmp/rpl_innodb_snapshot.out.file' INTO TABLE t1;
SELECT * FROM t1;
a
1
CHANGE MASTER TO master_host="127.0.0.1",master_port=MASTER_PORT,master_user="root",master_log_file="master-bin.000001",master_log_pos=binlog_pos;
START SLAVE;
SELECT * FROM t1;
a
1
2
3
SELECT * FROM t1_backup;
a
1
2
3
DROP TABLE t1_backup;
DROP TABLE t1;
# Switch to connection con1
CREATE TABLE t1 (a INT PRIMARY KEY) ENGINE=innodb;
INSERT INTO t1 VALUES(1);
# async queries from con2
INSERT INTO t1 VALUES(2);
# async queries from con3
INSERT INTO t1 VALUES(21);
# Switch to connection con1
# Switch to connection con4
INSERT INTO t1 VALUES(9);
# Switch to connection con1
SELECT * INTO OUTFILE '<MYSQLTEST_VARDIR>/tmp/rpl_innodb_snapshot.out.file' FROM t1;
COMMIT;
# reap async statements
# Switch to slave
CREATE TABLE t1_backup AS SELECT * FROM t1;
STOP SLAVE;
RESET SLAVE;
DELETE FROM t1;
LOAD DATA INFILE '<MYSQLTEST_VARDIR>/tmp/rpl_innodb_snapshot.out.file' INTO TABLE t1;
CHANGE MASTER TO master_host="127.0.0.1",master_port=MASTER_PORT,master_user="root",master_log_file="master-bin.000001",master_log_pos=binlog_pos;
START SLAVE;
# sync and then query slave
ShouldBeZero
0
DROP TABLE t1_backup;
DROP TABLE t1;
# Switch to connection default + close connections con1 and con2
