drop table if exists t1;
create table t1 (i int primary key auto_increment) engine=innodb;
create table t2 (i int primary key auto_increment) engine=innodb;
create table t3 (i int primary key auto_increment) engine=innodb;
create table t4 (i int primary key auto_increment) engine=innodb;
insert into t1 values (1);
insert into t1 select null from t1;
insert into t1 select null from t1;
insert into t1 select null from t1;
insert into t1 select null from t1;
insert into t1 select null from t1;
insert into t1 select null from t1;
insert into t1 select null from t1;
insert into t1 select null from t1;
insert into t1 select null from t1;
insert into t1 select null from t1;
insert into t1 select null from t1;
insert into t1 select null from t1;
insert into t1 select null from t1;
insert into t1 select null from t1;
insert into t2 select * from t1;
insert into t3 select * from t1;
insert into t4 select * from t1;
begin;
select count(*) from t1;
count(*)
16384
delete from t1 limit 1000;
delete from t2 limit 1000;
delete from t3 limit 1000;
delete from t4 limit 1000;
delete from t1 limit 1000;
delete from t2 limit 1000;
delete from t3 limit 1000;
delete from t4 limit 1000;
delete from t1 limit 1000;
delete from t2 limit 1000;
delete from t3 limit 1000;
delete from t4 limit 1000;
delete from t1 limit 1000;
delete from t2 limit 1000;
delete from t3 limit 1000;
delete from t4 limit 1000;
delete from t1 limit 1000;
delete from t2 limit 1000;
delete from t3 limit 1000;
delete from t4 limit 1000;
delete from t1 limit 1000;
delete from t2 limit 1000;
delete from t3 limit 1000;
delete from t4 limit 1000;
rollback;
select count(*) from t1;
count(*)
10384
select count(*) from t2;
count(*)
10384
select count(*) from t3;
count(*)
10384
select count(*) from t4;
count(*)
10384
drop table t1;
drop table t2;
drop table t3;
drop table t4;
