include/master-slave.inc
[connection master]
STOP SLAVE;
SET GLOBAL replicate_events_marked_for_skip=FILTER_ON_MASTER;
SELECT @@global.replicate_events_marked_for_skip;
@@global.replicate_events_marked_for_skip
filter_on_master
START SLAVE;
CREATE TABLE t1 (a INT PRIMARY KEY, b INT) ENGINE=innodb;
CREATE TABLE t2 (a INT PRIMARY KEY, b INT) ENGINE=innodb;
INSERT INTO t1(a) VALUES (1);
INSERT INTO t2(a) VALUES (1);
SET skip_replication=1;
CREATE TABLE t3 (a INT PRIMARY KEY, b INT) ENGINE=innodb;
BEGIN;
INSERT INTO t1(a) VALUES (2);
INSERT INTO t2(a) VALUES (2);
INSERT INTO t2(a) VALUES (8);
INSERT INTO t2(a) VALUES (9);
UPDATE t1 SET b=7 WHERE a=2;
REPLACE INTO t2 (a,b) VALUES (2,7);
COMMIT;
BEGIN;
DELETE FROM t2 WHERE a=8;
DELETE FROM t2 WHERE a=9;
COMMIT;
FLUSH NO_WRITE_TO_BINLOG LOGS;
Should not include t3
SHOW TABLES;
Tables_in_test
t1
t2
Should have one row per table
SELECT * FROM t1;
a	b
1	NULL
SELECT * FROM t2;
a	b
1	NULL
DROP TABLE t3;
FLUSH NO_WRITE_TO_BINLOG LOGS;
STOP SLAVE;
SET GLOBAL replicate_events_marked_for_skip=FILTER_ON_SLAVE;
START SLAVE;
SET skip_replication=1;
CREATE TABLE t3 (a INT PRIMARY KEY, b INT) ENGINE=innodb;
BEGIN;
INSERT INTO t1(a) VALUES (3);
INSERT INTO t2(a) VALUES (3);
INSERT INTO t2(a) VALUES (4);
COMMIT;
BEGIN;
UPDATE t1 set b=3 WHERE a=3;
UPDATE t2 set b=3 WHERE a=3;
DELETE FROM t2 where a=4;
REPLACE INTO t2 (a,b) VALUES (3,4);
COMMIT;
FLUSH NO_WRITE_TO_BINLOG LOGS;
Should not include t3
SHOW TABLES;
Tables_in_test
t1
t2
Should have one row per table
SELECT * FROM t1;
a	b
1	NULL
SELECT * FROM t2;
a	b
1	NULL
DROP TABLE t3;
FLUSH NO_WRITE_TO_BINLOG LOGS;
STOP SLAVE;
SET GLOBAL replicate_events_marked_for_skip=REPLICATE;
START SLAVE;
SET skip_replication=1;
CREATE TABLE t3 (a INT PRIMARY KEY, b INT) ENGINE=innodb;
BEGIN;
INSERT INTO t3(a) VALUES(2);
UPDATE t3 set b=2 WHERE a=2;
INSERT INTO t3(a) VALUES(3);
COMMIT;
BEGIN;
DELETE FROM t3 where a=3;
REPLACE INTO t3 VALUES (2,3);
COMMIT;
Should have one row (2,3)
SELECT * FROM t3;
a	b
2	3
DROP TABLE t3;
TRUNCATE t1;
RESET MASTER;
SET skip_replication=0;
BEGIN;
INSERT INTO t1 VALUES (1,0);
UPDATE t1 SET b=1 where a=1;
INSERT INTO t1 VALUES (7,0);
COMMIT;
SET skip_replication=1;
BEGIN;
INSERT INTO t1 VALUES (2,0);
REPLACE INTO t1 VALUES (1,2);
DELETE FROM t1 WHERE a=7;
COMMIT;
SET skip_replication=0;
BEGIN;
INSERT INTO t1 VALUES (3,0);
UPDATE t1 SET b=3 WHERE a=3;
INSERT INTO t1 VALUES (4,0);
COMMIT;
BEGIN;
DELETE FROM t1 WHERE a=4;
REPLACE INTO t1 VALUES (3,4);
COMMIT;
Should have 3 rows
SELECT * FROM t1 ORDER by a;
a	b
1	2
2	0
3	4
STOP SLAVE;
SET GLOBAL replicate_events_marked_for_skip=FILTER_ON_MASTER;
TRUNCATE t1;
Should have 3 rows (1,2), (2,0), (3,4)
SELECT * FROM t1 ORDER by a;
a	b
1	2
2	0
3	4
START SLAVE;
Should have three rows (1,1), (3,4), (7,0)
SELECT * FROM t1 ORDER by a;
a	b
1	1
3	4
7	0
SET skip_replication= 0;
TRUNCATE t1;
STOP SLAVE;
SET GLOBAL replicate_events_marked_for_skip=FILTER_ON_MASTER;
START SLAVE IO_THREAD;
SET skip_replication= 1;
BEGIN;
INSERT INTO t1(a) VALUES (1);
UPDATE t1 SET b=1 WHERE a=1;
COMMIT;
SET skip_replication= 0;
BEGIN;
INSERT INTO t1(a) VALUES (2);
UPDATE t1 SET b=2 WHERE a=2;
COMMIT;
include/wait_for_slave_param.inc [Master_Log_File]
include/wait_for_slave_param.inc [Read_Master_Log_Pos]
STOP SLAVE IO_THREAD;
SET GLOBAL replicate_events_marked_for_skip=REPLICATE;
START SLAVE;
This should display one row with (2)
SELECT * FROM t1;
a	b
2	2
SET skip_replication= 0;
TRUNCATE t1;
STOP SLAVE;
SET GLOBAL replicate_events_marked_for_skip=FILTER_ON_SLAVE;
START SLAVE IO_THREAD;
SET skip_replication= 1;
BEGIN;
INSERT INTO t1(a) VALUES (1);
UPDATE t1 SET b=1 WHERE a=1;
COMMIT;
SET skip_replication= 0;
BEGIN;
INSERT INTO t1(a) VALUES (2);
UPDATE t1 SET b=2 WHERE a=2;
COMMIT;
include/wait_for_slave_param.inc [Master_Log_File]
include/wait_for_slave_param.inc [Read_Master_Log_Pos]
STOP SLAVE IO_THREAD;
SET GLOBAL replicate_events_marked_for_skip=REPLICATE;
START SLAVE;
This should display two rows (1) and (2)
SELECT * FROM t1 ORDER BY a;
a	b
1	1
2	2
SET skip_replication= 0;
TRUNCATE t1;
STOP SLAVE;
SET GLOBAL replicate_events_marked_for_skip=REPLICATE;
START SLAVE IO_THREAD;
SET skip_replication= 1;
BEGIN;
INSERT INTO t1(a) VALUES (1);
UPDATE t1 SET b=1 WHERE a=1;
COMMIT;
SET skip_replication= 0;
BEGIN;
INSERT INTO t1(a) VALUES (2);
UPDATE t1 SET b=2 WHERE a=2;
COMMIT;
include/wait_for_slave_param.inc [Master_Log_File]
include/wait_for_slave_param.inc [Read_Master_Log_Pos]
STOP SLAVE IO_THREAD;
SET GLOBAL replicate_events_marked_for_skip=FILTER_ON_MASTER;
START SLAVE;
This should display one row (2,2)
SELECT * FROM t1 ORDER BY a;
a	b
2	2
SET skip_replication=0;
DROP TABLE t1,t2;
STOP SLAVE;
SET GLOBAL replicate_events_marked_for_skip=REPLICATE;
START SLAVE;
include/rpl_end.inc
